{
  "schema_version": "2.0.0",
  "interview_context": {
    "schema_version": "1.0.0",
    "company": "Unknown synthetic company",
    "level": "Junior",
    "research": {
      "mode": "unavailable",
      "usage": {
        "search_queries": 0,
        "pages_fetched": 0,
        "playwright_pages": 0,
        "navigation_depth_used": 0,
        "total_tokens": 0,
        "max_retries_used_per_page": 0,
        "runtime_seconds": 0
      },
      "queries": [],
      "pages": [],
      "stop_reason": "research_not_run",
      "gaps": [
        "Company identity is not provided.",
        "Product track or team is not provided.",
        "No official interview-process evidence is available.",
        "No reported interview experiences or questions are available."
      ]
    },
    "signals": [
      {
        "signal_id": "SIG-JD-01",
        "layer": "track_team_level_requirement",
        "statement": "The role emphasizes identifying valuable generative-AI workflows and defining MVP scope and requirements.",
        "source_status": "inferred_from_jd",
        "presented_as": "possible",
        "tier": "unknown",
        "sources": [
          {
            "origin": "job_description",
            "reference": "target_jd.md, Responsibilities, bullets 1–2"
          }
        ],
        "freshness": "unknown",
        "level": "Junior"
      },
      {
        "signal_id": "SIG-JD-02",
        "layer": "track_team_level_requirement",
        "statement": "The role emphasizes evaluation, quality measurement, failure analysis, reliability, safety, and improvement prioritization.",
        "source_status": "inferred_from_jd",
        "presented_as": "possible",
        "tier": "unknown",
        "sources": [
          {
            "origin": "job_description",
            "reference": "target_jd.md, Responsibilities, bullets 4–6"
          }
        ],
        "freshness": "unknown",
        "level": "Junior"
      },
      {
        "signal_id": "SIG-JD-03",
        "layer": "track_team_level_requirement",
        "statement": "The role emphasizes cross-functional work and communication of product decisions and tradeoffs.",
        "source_status": "inferred_from_jd",
        "presented_as": "possible",
        "tier": "unknown",
        "sources": [
          {
            "origin": "job_description",
            "reference": "target_jd.md, Responsibilities, bullets 3 and 7"
          }
        ],
        "freshness": "unknown",
        "level": "Junior"
      }
    ],
    "questions": [
      {
        "question_id": "Q1",
        "text": "How did you identify the user workflow or problem addressed by the project analysis Agent?",
        "layer": "track_team_level_requirement",
        "source_status": "inferred_from_jd",
        "presented_as": "possible",
        "priority": "P0",
        "tier": "unknown",
        "sources": [
          {
            "origin": "job_description",
            "reference": "target_jd.md, Responsibilities, bullet 1"
          }
        ],
        "freshness": "unknown",
        "why_it_is_likely": "The JD explicitly requires identifying valuable user workflows for generative AI.",
        "level": "Junior"
      },
      {
        "question_id": "Q2",
        "text": "What was the MVP scope, and how were the product requirements defined?",
        "layer": "track_team_level_requirement",
        "source_status": "inferred_from_jd",
        "presented_as": "possible",
        "priority": "P0",
        "tier": "unknown",
        "sources": [
          {
            "origin": "job_description",
            "reference": "target_jd.md, Responsibilities, bullet 2"
          }
        ],
        "freshness": "unknown",
        "why_it_is_likely": "The JD explicitly requires defining MVP scope and product requirements.",
        "level": "Junior"
      },
      {
        "question_id": "Q3",
        "text": "How did you work with engineering and design, and what did you personally own?",
        "layer": "track_team_level_requirement",
        "source_status": "inferred_from_jd",
        "presented_as": "possible",
        "priority": "P0",
        "tier": "unknown",
        "sources": [
          {
            "origin": "job_description",
            "reference": "target_jd.md, Responsibilities, bullet 3"
          }
        ],
        "freshness": "unknown",
        "why_it_is_likely": "The JD requires cross-functional work, while the project source does not identify individual ownership.",
        "level": "Junior"
      },
      {
        "question_id": "Q4",
        "text": "How did you evaluate output quality, and which measurements or test cases did you use?",
        "layer": "track_team_level_requirement",
        "source_status": "inferred_from_jd",
        "presented_as": "possible",
        "priority": "P0",
        "tier": "unknown",
        "sources": [
          {
            "origin": "job_description",
            "reference": "target_jd.md, Responsibilities, bullet 4"
          }
        ],
        "freshness": "unknown",
        "why_it_is_likely": "The JD explicitly requires evaluation and quality measurement.",
        "level": "Junior"
      },
      {
        "question_id": "Q5",
        "text": "What Agent tools and context strategy did the product use, and how did you address reliability and safety?",
        "layer": "track_team_level_requirement",
        "source_status": "inferred_from_jd",
        "presented_as": "possible",
        "priority": "P0",
        "tier": "unknown",
        "sources": [
          {
            "origin": "job_description",
            "reference": "target_jd.md, Responsibilities, bullet 5"
          }
        ],
        "freshness": "unknown",
        "why_it_is_likely": "The JD names Agent tools, context, reliability, and safety.",
        "level": "Junior"
      },
      {
        "question_id": "Q6",
        "text": "Describe an important failure mode and how you prioritized an improvement.",
        "layer": "track_team_level_requirement",
        "source_status": "inferred_from_jd",
        "presented_as": "possible",
        "priority": "P1",
        "tier": "unknown",
        "sources": [
          {
            "origin": "job_description",
            "reference": "target_jd.md, Responsibilities, bullet 6"
          }
        ],
        "freshness": "unknown",
        "why_it_is_likely": "The JD explicitly requires failure analysis and improvement prioritization.",
        "level": "Junior"
      },
      {
        "question_id": "Q7",
        "text": "What product tradeoff did you make, and how did you communicate the decision?",
        "layer": "track_team_level_requirement",
        "source_status": "inferred_from_jd",
        "presented_as": "possible",
        "priority": "P1",
        "tier": "unknown",
        "sources": [
          {
            "origin": "job_description",
            "reference": "target_jd.md, Responsibilities, bullet 7"
          }
        ],
        "freshness": "unknown",
        "why_it_is_likely": "The JD explicitly requires communicating product decisions and tradeoffs.",
        "level": "Junior"
      }
    ],
    "unknowns": [
      "Company identity",
      "Product track or team",
      "Role location",
      "Actual interview stages",
      "Official interview questions",
      "Reported interview experiences",
      "Interview-process recency"
    ]
  },
  "role_profile_ref": {
    "role_id": "target_jd.md#junior-ai-product-manager",
    "version": "unversioned"
  },
  "project_version": "unversioned",
  "run_type": "agent_initial",
  "intent": "application_pack",
  "role_fit_map": [
    {
      "role_requirement_id": "JD-R1",
      "capability_id": "generative_ai_workflow_discovery",
      "relevance": "required",
      "status": "not_found",
      "source_refs": [
        {
          "source_id": "target_jd.md",
          "location": "Responsibilities, bullet 1"
        },
        {
          "source_id": "S02_project.md",
          "location": "Team Project, sentence 1"
        }
      ],
      "boundary": "The source establishes that the team built a project analysis Agent. It does not establish a user, user problem, discovery method, workflow-selection decision, or demonstrated workflow value.",
      "interview_risk": "High: the candidate cannot safely claim user discovery or workflow prioritization from the supplied evidence."
    },
    {
      "role_requirement_id": "JD-R2",
      "capability_id": "mvp_scope_and_product_requirements",
      "relevance": "required",
      "status": "not_found",
      "source_refs": [
        {
          "source_id": "target_jd.md",
          "location": "Responsibilities, bullet 2"
        },
        {
          "source_id": "S02_project.md",
          "location": "Team Project, sentences 1–2"
        }
      ],
      "boundary": "The source does not describe an MVP boundary, product requirements, prioritization rationale, or the candidate's role in defining them.",
      "interview_risk": "High: no grounded scope or requirements story is available."
    },
    {
      "role_requirement_id": "JD-R3",
      "capability_id": "cross_functional_collaboration",
      "relevance": "important",
      "status": "needs_confirmation",
      "source_refs": [
        {
          "source_id": "target_jd.md",
          "location": "Responsibilities, bullet 3"
        },
        {
          "source_id": "S02_project.md",
          "location": "Team Project, sentences 1–2"
        }
      ],
      "boundary": "The plural wording establishes a team project, but it does not identify engineering or design partners, collaboration practices, or the candidate's individual contribution.",
      "interview_risk": "High: team language must not be converted into individual ownership."
    },
    {
      "role_requirement_id": "JD-R4",
      "capability_id": "evaluation_and_quality_measurement",
      "relevance": "required",